{
  "schema_version": "7B.1",
  "world_id": "genesis_phase7e_true_map_seed_v1",
  "seed": "phase7e_hidden_world_seed_v1",
  "continents": [
    {"continent_id": "cont_a", "name": "Alpha Continent"},
    {"continent_id": "cont_b", "name": "Beta Continent"}
  ],
  "regions": [
    {"region_id": "cont_a_origin_valley", "continent_id": "cont_a", "name": "Origin Valley"},
    {"region_id": "cont_a_east_ridge", "continent_id": "cont_a", "name": "East Ridge"},
    {"region_id": "cont_a_north_wilds", "continent_id": "cont_a", "name": "North Wilds"},
    {"region_id": "cont_b_dawn_isle", "continent_id": "cont_b", "name": "Dawn Isle"},
    {"region_id": "cont_b_south_shore", "continent_id": "cont_b", "name": "South Shore"},
    {"region_id": "cont_b_west_cliffs", "continent_id": "cont_b", "name": "West Cliffs"}
  ],
  "tiles": [
    {
      "tile_id": "cont_a_origin_000",
      "continent_id": "cont_a",
      "region_id": "cont_a_origin_valley",
      "coordinates": {"x": 0, "y": 0},
      "terrain": "grassland",
      "biome": "temperate_valley",
      "elevation": 0.2,
      "water": {"type": "river", "drinkable": true},
      "resources": ["fruit", "reeds"],
      "hazards": [],
      "landmark_ids": ["lm_origin_river"],
      "blocks_travel": false
    },
    {
      "tile_id": "cont_a_origin_001",
      "continent_id": "cont_a",
      "region_id": "cont_a_origin_valley",
      "coordinates": {"x": 1, "y": 0},
      "terrain": "forest",
      "biome": "temperate_forest",
      "elevation": 0.3,
      "water": null,
      "resources": ["wood"],
      "hazards": [],
      "landmark_ids": ["lm_old_oak"],
      "blocks_travel": false
    },
    {
      "tile_id": "cont_a_origin_002",
      "continent_id": "cont_a",
      "region_id": "cont_a_origin_valley",
      "coordinates": {"x": 0, "y": 1},
      "terrain": "hill",
      "biome": "temperate_hills",
      "elevation": 0.5,
      "water": null,
      "resources": ["stone"],
      "hazards": ["steep_slope"],
      "landmark_ids": [],
      "blocks_travel": false
    },
    {
      "tile_id": "cont_a_east_000",
      "continent_id": "cont_a",
      "region_id": "cont_a_east_ridge",
      "coordinates": {"x": 3, "y": 0},
      "terrain": "mountain",
      "biome": "highland",
      "elevation": 0.9,
      "water": null,
      "resources": ["stone"],
      "hazards": ["unstable_rocks"],
      "landmark_ids": ["lm_east_summit"],
      "blocks_travel": false
    },
    {
      "tile_id": "cont_a_east_001",
      "continent_id": "cont_a",
      "region_id": "cont_a_east_ridge",
      "coordinates": {"x": 3, "y": 1},
      "terrain": "hill",
      "biome": "highland",
      "elevation": 0.6,
      "water": null,
      "resources": ["stone"],
      "hazards": [],
      "landmark_ids": [],
      "blocks_travel": false
    },
    {
      "tile_id": "cont_a_north_000",
      "continent_id": "cont_a",
      "region_id": "cont_a_north_wilds",
      "coordinates": {"x": -1, "y": 2},
      "terrain": "forest",
      "biome": "dense_woodland",
      "elevation": 0.4,
      "water": null,
      "resources": ["wood"],
      "hazards": ["dense_thorns"],
      "landmark_ids": [],
      "blocks_travel": false
    },
    {
      "tile_id": "cont_a_north_001",
      "continent_id": "cont_a",
      "region_id": "cont_a_north_wilds",
      "coordinates": {"x": -1, "y": 1},
      "terrain": "grassland",
      "biome": "temperate_valley",
      "elevation": 0.25,
      "water": null,
      "resources": ["fruit"],
      "hazards": [],
      "landmark_ids": [],
      "blocks_travel": false
    },
    {
      "tile_id": "cont_b_origin_000",
      "continent_id": "cont_b",
      "region_id": "cont_b_dawn_isle",
      "coordinates": {"x": 50, "y": 50},
      "terrain": "coast",
      "biome": "warm_coast",
      "elevation": 0.1,
      "water": {"type": "sea", "drinkable": false},
      "resources": ["shells", "driftwood"],
      "hazards": [],
      "landmark_ids": ["lm_dawn_cove"],
      "blocks_travel": false
    },
    {
      "tile_id": "cont_b_origin_001",
      "continent_id": "cont_b",
      "region_id": "cont_b_dawn_isle",
      "coordinates": {"x": 51, "y": 50},
      "terrain": "grassland",
      "biome": "warm_coast",
      "elevation": 0.15,
      "water": null,
      "resources": ["fruit"],
      "hazards": [],
      "landmark_ids": [],
      "blocks_travel": false
    },
    {
      "tile_id": "cont_b_origin_002",
      "continent_id": "cont_b",
      "region_id": "cont_b_dawn_isle",
      "coordinates": {"x": 50, "y": 51},
      "terrain": "forest",
      "biome": "coastal_forest",
      "elevation": 0.2,
      "water": null,
      "resources": ["wood"],
      "hazards": [],
      "landmark_ids": [],
      "blocks_travel": false
    },
    {
      "tile_id": "cont_b_south_000",
      "continent_id": "cont_b",
      "region_id": "cont_b_south_shore",
      "coordinates": {"x": 53, "y": 50},
      "terrain": "coast",
      "biome": "warm_coast",
      "elevation": 0.1,
      "water": {"type": "sea", "drinkable": false},
      "resources": ["shells"],
      "hazards": ["strong_tide"],
      "landmark_ids": ["lm_south_rocks"],
      "blocks_travel": false
    },
    {
      "tile_id": "cont_b_south_001",
      "continent_id": "cont_b",
      "region_id": "cont_b_south_shore",
      "coordinates": {"x": 53, "y": 51},
      "terrain": "forest",
      "biome": "coastal_forest",
      "elevation": 0.25,
      "water": null,
      "resources": ["wood"],
      "hazards": [],
      "landmark_ids": [],
      "blocks_travel": false
    },
    {
      "tile_id": "cont_b_west_000",
      "continent_id": "cont_b",
      "region_id": "cont_b_west_cliffs",
      "coordinates": {"x": 48, "y": 52},
      "terrain": "hill",
      "biome": "coastal_cliffs",
      "elevation": 0.5,
      "water": null,
      "resources": ["stone"],
      "hazards": ["unstable_rocks"],
      "landmark_ids": [],
      "blocks_travel": false
    },
    {
      "tile_id": "cont_b_west_001",
      "continent_id": "cont_b",
      "region_id": "cont_b_west_cliffs",
      "coordinates": {"x": 48, "y": 53},
      "terrain": "mountain",
      "biome": "highland",
      "elevation": 0.8,
      "water": null,
      "resources": ["stone"],
      "hazards": [],
      "landmark_ids": ["lm_west_ledge"],
      "blocks_travel": false
    }
  ],
  "landmarks": [
    {
      "landmark_id": "lm_origin_river",
      "continent_id": "cont_a",
      "tile_id": "cont_a_origin_000",
      "kind": "river",
      "hidden_name": "Whisper Brook",
      "description": "A narrow drinkable river flowing through the valley."
    },
    {
      "landmark_id": "lm_old_oak",
      "continent_id": "cont_a",
      "tile_id": "cont_a_origin_001",
      "kind": "tree",
      "hidden_name": "Sentry Oak",
      "description": "An ancient oak standing watch at the forest edge."
    },
    {
      "landmark_id": "lm_east_summit",
      "continent_id": "cont_a",
      "tile_id": "cont_a_east_000",
      "kind": "mountain_peak",
      "hidden_name": "East Crown",
      "description": "The highest peak on the eastern ridge."
    },
    {
      "landmark_id": "lm_dawn_cove",
      "continent_id": "cont_b",
      "tile_id": "cont_b_origin_000",
      "kind": "cove",
      "hidden_name": "Dawn Cove",
      "description": "A quiet curve of coast where the sun first touches the shore."
    },
    {
      "landmark_id": "lm_south_rocks",
      "continent_id": "cont_b",
      "tile_id": "cont_b_south_000",
      "kind": "rock_formation",
      "hidden_name": "Foam Teeth",
      "description": "Sharp rocks exposed at low tide."
    },
    {
      "landmark_id": "lm_west_ledge",
      "continent_id": "cont_b",
      "tile_id": "cont_b_west_001",
      "kind": "cliff_ledge",
      "hidden_name": "Seagull's Rest",
      "description": "A sheer cliff ledge overlooking the western sea."
    }
  ],
  "resources": [],
  "hazards": [],
  "mysteries": [
    {
      "mystery_id": "mst_east_echo",
      "tile_id": "cont_a_east_000",
      "kind": "repeating_sound",
      "reveal_threshold": 3
    },
    {
      "mystery_id": "mst_west_light",
      "tile_id": "cont_b_west_001",
      "kind": "distant_light",
      "reveal_threshold": 3
    }
  ],
  "travel_edges": [
    {"from_tile_id": "cont_a_origin_000", "to_tile_id": "cont_a_origin_001", "mode": "walk"},
    {"from_tile_id": "cont_a_origin_000", "to_tile_id": "cont_a_origin_002", "mode": "walk"},
    {"from_tile_id": "cont_a_origin_002", "to_tile_id": "cont_a_north_001", "mode": "walk"},
    {"from_tile_id": "cont_a_north_001", "to_tile_id": "cont_a_north_000", "mode": "walk"},
    {"from_tile_id": "cont_a_origin_001", "to_tile_id": "cont_a_east_000", "mode": "walk"},
    {"from_tile_id": "cont_a_east_000", "to_tile_id": "cont_a_east_001", "mode": "walk"},
    {"from_tile_id": "cont_b_origin_000", "to_tile_id": "cont_b_origin_001", "mode": "walk"},
    {"from_tile_id": "cont_b_origin_000", "to_tile_id": "cont_b_origin_002", "mode": "walk"},
    {"from_tile_id": "cont_b_origin_001", "to_tile_id": "cont_b_south_000", "mode": "walk"},
    {"from_tile_id": "cont_b_south_000", "to_tile_id": "cont_b_south_001", "mode": "walk"},
    {"from_tile_id": "cont_b_origin_002", "to_tile_id": "cont_b_west_000", "mode": "walk"},
    {"from_tile_id": "cont_b_west_000", "to_tile_id": "cont_b_west_001", "mode": "walk"}
  ]
}